PID,startdate,enddate,duration,week,noise,model_included,peak_time,peak_intensity,factors__current_season,factors__past_season,factors__past_season2,factors__model,survey_summary_from_participant
3236,2023-02-04 16:09:33,2023-02-04 16:33:34,1441,2,2.5,1,100.0,700.0,1,1,1,1,The goal of the study was to predict how well we could predict the day that hospitalizations would peak and how many hospitalizations that would be. Then the goal was to see how close we would predict it to an AI's prediction.
3241,2023-02-04 16:29:59,2023-02-04 16:33:50,230,4,10.0,1,98.0,1035.0,0,1,1,0,I had to see which day will have the maximum number of hospitalizations and the maximum hospitalizations on that day.
4890,2023-02-04 16:27:44,2023-02-04 16:33:51,366,1,10.0,0,80.0,1000.0,1,0,1,0,"To predict the day of the peak hospitalizations with respect to this new hypothetical pandemic, and to predict how many hospitalizations occur on that peak."
3921,2023-02-04 16:31:36,2023-02-04 16:33:57,141,3,10.0,1,112.0,1704.0,1,0,0,0,to see how people can read a graph and make an accurate prediction based on the information presented
1499,2023-02-04 16:32:14,2023-02-04 16:34:23,128,3,10.0,0,118.0,518.0,0,1,0,0,Looking at past data to predict future outcomes. 
4575,2023-02-04 16:30:19,2023-02-04 16:34:24,245,-2,2.5,1,104.0,2166.0,0,0,0,1,To see if I could use the graph and its data to make a predication on fictitious disease outbreak 
1920,2023-02-04 16:32:34,2023-02-04 16:34:39,124,4,5.0,1,98.0,1646.0,1,0,0,0,to predict data
3407,2023-02-04 16:14:47,2023-02-04 16:34:41,1193,1,5.0,1,135.0,1669.0,1,1,0,1,I think the goal was to gather predictions for the peak days and hospitalizations of viruses as a model. 
170,2023-02-04 16:32:09,2023-02-04 16:34:47,158,4,10.0,0,57.0,1465.0,1,0,1,0,to study the pattern of hospitalizations in data given
4083,2023-02-04 16:29:16,2023-02-04 16:35:00,344,-2,5.0,0,60.0,1600.0,1,0,0,0,To see if I could read a graph. To see what people thought 
3571,2023-02-04 16:27:16,2023-02-04 16:35:08,472,1,2.5,0,57.0,64.0,1,1,1,1,To study the pattern of incidence of hospitalization in the population caused by an infectious agent
5403,2023-02-04 16:28:17,2023-02-04 16:35:24,427,-2,10.0,0,59.0,1454.0,0,0,1,0,Estimate when the epidemic will peak and how many hospitalizations there will be.
426,2023-02-04 16:31:03,2023-02-04 16:35:32,268,4,2.5,0,104.0,455.0,1,1,1,0,I think the goal of the study was to determine how the average person can visualize data to predict what's to come.
3490,2023-02-04 16:32:38,2023-02-04 16:35:53,194,3,5.0,1,95.0,2159611.0,1,0,0,1,"To understand and evaluate date set from a model. And also find the worst case scenario in the simulation
"
4713,2023-02-04 16:31:13,2023-02-04 16:35:55,282,-2,10.0,1,100.0,3500.0,1,1,1,1,The goal of this study was to predict certain elements of a fictions infectious disease. With the data provided I was asked to predict the peak day as well as total hospitalizations. 
746,2023-02-04 16:31:08,2023-02-04 16:36:05,296,3,2.5,0,59.0,176.0,1,0,0,0,To see if a peak of a pandemic can be decided 
4222,2023-02-04 16:33:06,2023-02-04 16:36:20,193,-2,10.0,0,89.0,1123.0,1,1,1,0,To see how people interpret and extrapolate data 
4063,2023-02-04 16:33:10,2023-02-04 16:36:21,190,4,10.0,1,59.0,1454.0,1,0,0,0,This study was about forecasting incident hospitalizations. This event was cased by a fictitious infectious agent. 
2007,2023-02-04 16:33:19,2023-02-04 16:36:23,183,4,5.0,0,60.0,195.0,1,0,0,0,The goal was to see how well people analyze data and make predictions from it
4604,2023-02-04 16:34:16,2023-02-04 16:36:28,132,4,2.5,0,210.0,2500.0,0,0,1,0,to determine the peak sceneario of a ficticious virus
2579,2023-02-04 16:32:36,2023-02-04 16:36:32,236,4,5.0,1,99.0,1652.0,1,1,0,1,I think the goal was to see how people compare data and can come up with their predictions based on the info given.
5408,2023-02-04 16:34:04,2023-02-04 16:36:52,168,-2,2.5,0,84.0,1800.0,1,0,1,0,The understand our thought process is making an assessment on the data available. 
4346,2023-02-04 16:28:04,2023-02-04 16:36:57,532,1,5.0,0,84.0,1500.0,1,1,1,0,The goal of the study was to see if human predictions will be more accurate than modelling predictions.
1124,2023-02-04 16:32:27,2023-02-04 16:37:18,290,2,10.0,1,112.0,1300.0,1,1,1,1,I suppose how people view information on a chart and make assumptions based on limited data?
5904,2023-02-04 16:34:27,2023-02-04 16:37:22,175,2,5.0,0,60.0,65.0,0,0,1,0,The goal of this study was to interpret a graph and make an estimation based on data provided.
5682,2023-02-04 16:31:13,2023-02-04 16:37:30,377,-2,2.5,0,105.0,1750.0,1,1,1,0,Determine the peak day of hospitalizations and number of them.
3087,2023-02-04 16:33:26,2023-02-04 16:37:34,247,3,2.5,1,60.0,2000.0,0,0,1,0,I think the goal was to see if the average person could understand what the graph represents.  Sometimes graphs are very confusing so maybe this was to gauge that.
2976,2023-02-04 16:32:37,2023-02-04 16:37:39,302,2,2.5,1,107.0,64.0,1,0,0,0,To guage our predictions.
1415,2023-02-04 16:35:28,2023-02-04 16:37:55,147,3,5.0,1,59.0,200.0,1,0,0,0,It was to compare old data patterns to new data. 
1662,2023-02-04 16:36:56,2023-02-04 16:37:58,62,2,2.5,1,57.0,64.0,1,0,1,0,The goal of this study was to figure out when the peak day was.
3943,2023-02-04 16:35:17,2023-02-04 16:38:02,164,1,2.5,1,123.0,2700.0,1,1,1,1,Ability to read a graph and estimate?
4993,2023-02-04 16:35:29,2023-02-04 16:38:03,153,4,10.0,1,86.0,1479.0,1,1,1,1,how one reads two graphs and makes one prediction off the information 
3792,2023-02-04 16:35:10,2023-02-04 16:38:13,183,1,2.5,1,60.0,2000.0,0,0,1,0,To predict the next season or years hospital peak in terms of days and hospitalization of patients. Understanding the graph I am looking at to make a prediction.
2001,2023-02-04 16:33:40,2023-02-04 16:38:15,274,3,5.0,0,57.0,1900.0,1,0,1,0,Using data to come to a conclusion 
1165,2023-02-04 16:32:04,2023-02-04 16:38:18,374,-2,5.0,0,210.0,2500.0,1,0,0,0,The goa of this particular fake study was about a fake virus that could cause a pandemic. The other goal was to see in 30 weeks how many people would be in the hospital because of this virus and what day these hospital stays occur and how long until the number of people in the hospital rop.
4799,2023-02-04 16:31:24,2023-02-04 16:38:32,428,-2,5.0,1,81.0,991.0,1,1,1,1,I think the researchers are trying to determine if non-researchers can understand prediction graphs like these.  Not sure though...
3650,2023-02-04 16:29:41,2023-02-04 16:38:42,540,1,2.5,1,122.0,1723.0,1,1,1,0,To test peoples ability to predict outcomes of illnesses. Also to do that using simple graphs and not different technology .
4533,2023-02-04 16:31:55,2023-02-04 16:38:48,413,1,2.5,0,55.0,100.0,1,1,1,0,I do not care in the slightest
5571,2023-02-04 16:35:53,2023-02-04 16:38:57,184,-2,2.5,1,-56.0,1900.0,0,0,1,0,Im not really  sure what the goal of the study was I believe it was to read a graph
3753,2023-02-04 16:34:58,2023-02-04 16:39:02,243,2,2.5,0,72.0,355.0,1,0,0,0,To make an estimate about a peak day using data. 
5892,2023-02-04 16:28:51,2023-02-04 16:39:11,619,3,10.0,1,103.0,1710.0,0,0,0,1,The way graphs are interpreted. Are we as oridinary people able to read accurately.===
114,2023-02-04 16:32:37,2023-02-04 16:39:16,399,2,2.5,0,74.0,272.0,1,1,1,0,To see when the current hospitalizations would peak using the data from the past 2 years.
440,2023-02-04 16:30:28,2023-02-04 16:39:17,528,4,2.5,1,84.0,1200.0,1,1,1,0,prediction of peak day and number of hospital incidents given a pandemic or epidemic
1524,2023-02-04 16:37:18,2023-02-04 16:39:46,147,4,2.5,0,70.0,275.0,1,0,1,0,The goal of this study was to estimate when the peak of the pandemic will occur given historical data. 
185,2023-02-04 16:20:56,2023-02-04 16:39:53,1136,1,10.0,1,113.0,3500.0,0,0,0,1,I am not quite sure. Maybe to see what caused overconfidence or underconfidence and what people used to guess
3862,2023-02-04 16:33:16,2023-02-04 16:39:56,400,-2,5.0,1,120.0,1600.0,1,0,1,1,Predict based on the graft when the illness would be at its worst.
560,2023-02-04 16:32:18,2023-02-04 16:40:02,463,3,2.5,1,140.0,525.0,0,1,1,0,It was seeking to see how people would make predictions based on past data. It is judging how people will make inferences on it. 
3125,2023-02-04 16:33:47,2023-02-04 16:40:07,379,1,10.0,0,79.0,279.0,1,1,1,0,To see if people use predictive models the way computers do?
5579,2023-02-04 16:36:16,2023-02-04 16:40:16,239,3,2.5,0,57.0,64.0,1,0,0,0,To summarize data about a disease and its peaks. Accessing the data and reporting it.
3453,2023-02-04 16:36:14,2023-02-04 16:40:30,256,2,10.0,0,98.0,800.0,1,1,1,0,The goal was to estimate the peak incidents and the day at which it occurs.
2883,2023-02-04 16:36:54,2023-02-04 16:40:34,219,-2,2.5,1,121.0,1920.0,1,1,1,0,To analyze past and present data to make a pandemic prediction.
908,2023-02-04 16:37:16,2023-02-04 16:40:45,209,2,5.0,1,130.0,2300.0,1,1,1,1,The goal was to see what individuals predict the peak number of infections and the day of the peak number of infections when given surveillance data.
2105,2023-02-04 16:34:17,2023-02-04 16:40:49,392,4,2.5,1,1955.0,57.0,0,0,1,0,"It seems that the goal of the study is to figure out how to read charted data. The data indicates the amount of hospitalizations were not random and they can be read, but they were unpredictable."
5863,2023-02-04 16:35:54,2023-02-04 16:40:56,301,3,10.0,0,102.0,211.0,1,1,0,0,The goal of the study was to have participants predict the exact date and number of associated hosptializations for an ongoing epidemic.  I was able to refer to the data from the two immediately prior seasons.
1317,2023-02-04 16:38:30,2023-02-04 16:41:01,150,2,2.5,0,57.0,70.0,1,1,1,0,the goal of the study was to predict the peak number of hospitalizations on the peak day
1161,2023-02-04 16:37:04,2023-02-04 16:41:13,248,3,10.0,1,103.0,1700.0,1,1,1,1,To predict trends in sickness/hospitalization and when we can determine peak hospitalization and that sickness to start to trend downward
3999,2023-02-04 16:39:36,2023-02-04 16:41:19,103,1,2.5,0,57.0,64.0,0,0,1,0,Unsure what the goal of the study was. 
4642,2023-02-04 16:36:08,2023-02-04 16:41:39,331,2,5.0,1,100.0,2400.0,1,1,1,1,To see if hospitalizations can be effectively estimated based on a combination of certain sets of data.
2784,2023-02-04 16:33:09,2023-02-04 16:41:46,517,2,10.0,1,98.0,900.0,1,1,1,0,To see what day we thought that the infection would peak in a hospital and how many cases there would be.
3752,2023-02-04 16:32:46,2023-02-04 16:41:53,546,1,5.0,0,70.0,153.0,1,0,0,0,"To determine peoples expectations of hospitalization o fan unknown virus,"
3755,2023-02-04 16:38:25,2023-02-04 16:41:58,213,3,5.0,0,100.0,200.0,1,1,1,0,The goal of this study was to see how people interpret past data to predict the future.
1013,2023-02-04 16:36:17,2023-02-04 16:42:01,343,4,5.0,0,57.0,62.0,1,1,1,0,To study the incidence pattern of hospitalization caused by the outbreak of an infectious virus in a large city.
5124,2023-02-04 15:51:37,2023-02-04 16:42:50,3073,-2,10.0,0,59.0,119.0,0,0,1,0,The goal of this study is to forecast and predict when an outbreak of a disease might happen
4305,2023-02-04 16:35:43,2023-02-04 16:42:54,430,3,10.0,1,62.0,116.0,1,0,0,1,The goal of this study was to predict when a fictitious epidemic reached it's peak and how many incident hospitalizations occurred then. 
2082,2023-02-04 16:37:53,2023-02-04 16:42:58,305,4,5.0,1,98.0,500.0,0,0,1,0,I have no idea what this study was about. I can't be certain 
2790,2023-02-04 16:05:32,2023-02-04 16:42:58,2245,1,5.0,1,57.0,62.0,1,0,0,0,The goal was to see if we can estimate the peak of the epidemic. We are trying to estimate the day and number of hospitalizations.
2143,2023-02-04 16:35:41,2023-02-04 16:43:16,455,4,10.0,0,120.0,1900.0,1,1,0,0,To see how humans can use data for predictive modeling.  To see how many different conclusions can be drawn with the same data when humans are using it as a predictive model.
3127,2023-02-04 16:37:16,2023-02-04 16:43:32,376,2,10.0,0,64.0,133.0,1,0,0,0,The peak day for a current pandemic and how many hospitalizations will have been caused daily.
3940,2023-02-04 16:36:26,2023-02-04 16:43:38,431,-2,10.0,1,83.0,750.0,1,1,1,0,The goal was to predict the peak day of an epidemic and hospitalization number on that day.
5850,2023-02-04 16:41:37,2023-02-04 16:43:41,124,2,5.0,0,90.0,3000.0,1,1,1,0,I genuinely have no idea
3294,2023-02-04 16:41:10,2023-02-04 16:43:44,154,1,5.0,0,82.0,1500.0,1,1,1,0,Observe data about a pandemic and predict the day and the magnitude of the day with the most hospitalizations.
4192,2023-02-04 16:32:53,2023-02-04 16:43:45,652,2,10.0,0,94.0,1185.0,0,1,0,0,To try and predict the outcome of a pandemic.
4093,2023-02-04 16:42:07,2023-02-04 16:43:49,101,-2,5.0,0,112.0,500.0,1,1,1,0,The goal of the study was to use the chart to predict this season outcome. can use the last two and projected this season to find it
3885,2023-02-04 16:40:42,2023-02-04 16:44:00,197,2,2.5,1,98.0,3200.0,1,0,0,1,To estimate peoples' perceptions about history repeating itself
4474,2023-02-04 16:37:40,2023-02-04 16:44:00,379,3,2.5,1,83.0,350.0,1,1,0,1,To see how having historical data vs currently collected data impacted someone's decision making/which data would someone put more trust in.
3719,2023-02-04 16:42:22,2023-02-04 16:44:25,122,4,2.5,1,57.0,64.0,1,1,1,0,The goal of the study was to present information that was taken by three different systems and analyze the differences between them in the number of hospitalizations and the days that passed.
637,2023-02-04 16:29:04,2023-02-04 16:44:25,921,1,10.0,1,120.0,1700.0,1,1,0,0,Seeing how ordinary people decipher graphs and data.
1889,2023-02-04 16:42:06,2023-02-04 16:45:38,211,1,5.0,1,112.0,2500.0,1,0,0,1,To get opinions/takes on patterns in data 
302,2023-02-04 16:38:46,2023-02-04 16:45:44,417,4,5.0,0,53.0,1666.0,0,0,1,0,To measure the peak of a nonexistent virus.
5758,2023-02-04 16:42:41,2023-02-04 16:45:50,189,-2,5.0,1,94.0,600.0,0,1,1,1,To estimate when the number of hospitalizations will peak.
0,2023-02-04 16:42:07,2023-02-04 16:45:56,229,3,5.0,1,57.0,62.0,0,1,1,1,"The goal of the study was how well we are able to look at the graph and predict what was happening. Paying attention most likely. I think I interpreted the graph wrong, I hit submit and then realized my mistake. "
3827,2023-02-04 16:40:59,2023-02-04 16:46:11,312,-2,10.0,1,100.0,710.0,0,0,0,1,I took an average of the last two seasons and the prediction model. I sort of created my own bell curse based on that. 
4424,2023-02-04 16:37:49,2023-02-04 16:46:13,503,1,10.0,0,50.0,1500.0,0,1,1,0,To estimate the peak time and day for a pandemic
776,2023-02-04 16:44:41,2023-02-04 16:46:30,108,4,5.0,0,60.0,1750.0,1,1,0,0,"The goal of the study was to try and estimate what the peak day would be as far as infections were concerned, but also to try and estimate what the peak day would be for hospitalizations."
1390,2023-02-04 16:43:39,2023-02-04 16:46:39,180,-2,10.0,0,150.0,1500.0,1,1,1,1,The goal of the study to me seemed to see how we interpret data trends and how well we predict future trends.
2359,2023-02-04 16:43:16,2023-02-04 16:47:06,230,2,2.5,0,95.0,900.0,1,1,1,0,"I used surveillance data from this season, the previous season, and the season before that to make predictions about hospitalizations during an epidemic. I had to predict on what day it would peak, and how many hospitalizations there would be at the peak."
1693,2023-02-04 16:40:54,2023-02-04 16:47:40,405,3,10.0,0,75.0,600.0,0,1,1,0,To gather predictions of an outbreak from different people and determine a general trend when all predictions are considered
2548,2023-02-04 16:46:13,2023-02-04 16:48:03,109,1,5.0,0,57.0,1666.0,0,0,1,0,To understand the general public's ability to assess data as presented in a graph
3760,2023-02-04 16:43:16,2023-02-04 16:48:08,291,2,10.0,1,105.0,118000.0,1,1,0,1,We were to estimate the peak day of the number of infections for a hypothetical virus outbreak. Also estimate number of patients on that day. 
3476,2023-02-04 16:43:38,2023-02-04 16:48:16,277,2,5.0,1,90.0,600.0,1,1,1,0,I think the goal was to see how much people used the trend data versus knowing that there will be peak/outlier days that go much higher or lower than the trend.
3919,2023-02-04 16:44:19,2023-02-04 16:48:44,265,3,5.0,1,100.0,2300.0,0,0,0,1,To see if people can accurately predict a ficticious endemic given various sources of data and predictions
2081,2023-02-04 16:46:09,2023-02-04 16:48:50,160,1,10.0,0,69.0,164.0,1,1,1,0,The goal was to see how users include given data to make assumptions.
2397,2023-02-04 16:42:19,2023-02-04 16:48:58,398,1,5.0,1,120.0,1520.0,1,1,1,0,The goal of the study is to predict the day the hospitalization reach its peak 
1736,2023-02-04 16:41:09,2023-02-04 16:49:03,473,4,10.0,1,100.0,1435.0,0,0,0,1,The goal of the study was to determine the peak days of the epidemic.
1229,2023-02-04 16:46:08,2023-02-04 16:49:04,175,1,2.5,1,110.0,1750.0,1,0,1,1,Crowdsourcing pandemic predictions. 
4014,2023-02-04 16:46:25,2023-02-04 16:49:04,159,2,2.5,1,115.0,500.0,1,0,0,1,To estimate what the peak day and peak number of hospitalizations would be for a fictitious pandemic.
1847,2023-02-04 16:47:09,2023-02-04 16:49:38,148,3,2.5,1,65.0,2000.0,1,0,1,0,to evaluate understanding of trends and extrapolation of data?
4744,2023-02-04 16:42:08,2023-02-04 16:49:45,456,2,10.0,1,106.0,500.0,1,1,1,1,You may be looking to see how understandable such a graph is and how people interpolate from it.  
4413,2023-02-04 16:48:34,2023-02-04 16:50:21,107,1,10.0,0,100.0,110.0,1,1,1,0,extrapolating data
5129,2023-02-04 16:48:36,2023-02-04 16:50:22,105,-2,5.0,1,56.0,1700.0,0,0,1,0,To make predictions on a hypothetical pandemic 
737,2023-02-04 16:45:31,2023-02-04 16:50:24,293,4,2.5,0,57.0,1950.0,0,0,1,0,If a pandemic can be predicted on past data.
3809,2023-02-04 16:40:58,2023-02-04 16:50:35,576,1,10.0,1,98.0,700.0,1,0,0,0,To predict the peak of a fluenza epidemic
3255,2023-02-04 16:42:31,2023-02-04 16:50:36,484,2,5.0,0,97.0,1158.0,1,1,1,0,The goal of the study is measuring how people judge and estimate statistics
1158,2023-02-04 16:38:12,2023-02-04 16:50:38,746,-2,10.0,0,89.0,1454.0,1,0,0,0,To predict when incidents and hospitalizations may occur due to influenza. Data can only predict but not be 100% accurate.
583,2023-02-04 16:46:25,2023-02-04 16:50:49,264,4,2.5,1,110.0,600.0,1,1,0,1,To see how well I could interpret data based on historical trends and the predicted models.
5229,2023-02-04 16:45:27,2023-02-04 16:50:50,322,4,5.0,1,90.0,800.0,0,0,1,0,to geuss the day a pandemic would peak in a season and the hospitlization of the people
4272,2023-02-04 16:46:59,2023-02-04 16:50:57,238,-2,10.0,1,98.0,450.0,1,0,0,0,To see how participants are able to parse noisy statistical data and infer trends based on them.
3507,2023-02-04 16:46:05,2023-02-04 16:50:59,294,3,2.5,1,57.0,1955.0,0,0,1,0,I think the goal of the study was to determine how regular people would interpret medical graphs? I'm not quite sure if this is correct. I got confused looking at the data and forgot what the purpose was after trying to figure out what was going on...
2550,2023-02-04 16:36:54,2023-02-04 16:51:06,852,-2,10.0,1,100.0,1600.0,1,1,0,1,How people perceive graphs for pandemics.
2412,2023-02-04 16:42:36,2023-02-04 16:51:13,517,2,10.0,0,90.0,900.0,1,1,1,0,The goal was to provide an estimate for the peak of a proposed epidemic. A graph was provided to help in determining this estimate.
3675,2023-02-04 16:49:55,2023-02-04 16:51:21,85,2,2.5,0,57.0,64.0,0,1,0,0,Studying interpretation of data
5607,2023-02-04 16:45:55,2023-02-04 16:52:04,368,3,10.0,1,85.0,1000.0,1,1,1,1,"The goal was to look at epidemic information for the current season and predict when it would peak and how many hospitalizations there would be on that peak day. We were given the trend so far this season along with data from last season, two seasons ago, and prediction models for this season."
4548,2023-02-04 16:47:20,2023-02-04 16:52:05,284,4,2.5,1,98.0,1897357.0,0,0,0,1,To use various data to determine the peak day and number of cases.
724,2023-02-04 16:44:14,2023-02-04 16:52:17,483,-2,2.5,1,55.0,1950.0,0,0,1,0,To read a graph. If most know how to.
633,2023-02-04 16:50:08,2023-02-04 16:52:23,135,4,5.0,1,86.0,1500.0,1,0,0,1,Predicting the peak day of a fake disease and the amount of hospitalizations of that disease.
3770,2023-02-04 16:40:23,2023-02-04 16:52:33,730,4,10.0,0,114.0,510.0,0,1,0,1,Im honestly not sure ... ones ability to analyze graphs with dangerous epidemic data ? ...... also i used last seasons data as i thought that was the most recent data recorded for the system.
2219,2023-02-04 16:47:42,2023-02-04 16:52:50,307,-2,5.0,0,56.0,1700.0,0,0,1,0,To look at the chart/graph and understand when peak day and time was. 
5688,2023-02-04 16:47:53,2023-02-04 16:52:54,300,1,2.5,0,98.0,1300.0,1,1,1,0,"The goal of the study was, using two years of historical data and some incidental information about current data, to predict when this season the peak incidence would occur and at what number of cases that peak would be."
4038,2023-02-04 16:49:12,2023-02-04 16:52:58,225,2,10.0,0,79.0,410.0,1,1,1,0,Seeing how people make projections of a pandemic based on graphical data of previous data.
2093,2023-02-04 16:51:52,2023-02-04 16:53:01,68,-2,5.0,1,57.0,62.0,0,1,0,0,To see how people make predictions given data.
2961,2023-02-04 16:49:16,2023-02-04 16:53:01,225,2,2.5,1,100.0,2200.0,0,0,0,1,"To estimate the peak of the current infections, both in days and number of hospitalizations "
1213,2023-02-04 16:50:11,2023-02-04 16:53:07,175,2,5.0,1,56.0,1700.0,1,0,0,0,Analyze readings of the graph and data interpretation
2210,2023-02-04 16:47:28,2023-02-04 16:53:21,352,4,10.0,0,85.0,250.0,0,1,1,0,How average people can interpret statistics
3782,2023-02-04 16:50:45,2023-02-04 16:53:22,156,3,5.0,0,79.0,1700.0,0,0,1,0,"To estimate when an epidemic will hit, the peak date & how many hospitalizations to expect."
4519,2023-02-04 16:48:09,2023-02-04 16:53:40,330,2,10.0,1,112.0,2300.0,0,0,0,1,The goal was to make a prediction based on an interactive graph.
5618,2023-02-04 16:49:59,2023-02-04 16:53:42,223,2,5.0,0,73.0,539.0,1,1,1,0,The goal of the study was to find the day when the peak amount of incidents was to happen in the current season.
4937,2023-02-04 16:50:04,2023-02-04 16:53:52,228,4,5.0,0,99.0,650.0,1,1,1,0,"The goal seems to be gauging how people view and interpret data, specifically with how current data may relate to or otherwise trend with previous data."
2858,2023-02-04 16:30:59,2023-02-04 16:53:54,1374,1,10.0,0,79.0,729.0,1,0,0,0,I don't know.
4539,2023-02-04 16:41:09,2023-02-04 16:53:56,767,4,10.0,0,57.0,60.0,1,0,0,0,To predict the peak of the epidemic and how many would be hospitalized on that day.
3818,2023-02-04 16:52:03,2023-02-04 16:53:59,115,3,2.5,0,53.0,173.0,1,0,0,0,to see if people could read a graph
1423,2023-02-04 16:42:22,2023-02-04 16:54:13,710,3,5.0,1,86.0,414.0,1,0,1,1,"The summery of this survey was to determine, based on the evidence of two previous epidemic outbreaks, the peak stay of a third outbreak and the duration of the outbreak, given new data at the start of the third outbreak."
4146,2023-02-04 16:50:55,2023-02-04 16:54:16,200,-2,2.5,0,90.0,1720.0,1,0,0,0,To have us predict outcomes using estimated data points.
3583,2023-02-04 16:47:58,2023-02-04 16:54:35,397,1,5.0,0,84.0,620.0,1,1,0,0,To predict when the peak of hospitalizations would be and the number of hospitalizations at the peak.
2535,2023-02-04 16:43:55,2023-02-04 16:54:36,641,4,10.0,1,90.0,500.0,1,1,0,0,To identify people's ability to predict how epidemics will behave and peak based on data.
1443,2023-02-04 16:50:00,2023-02-04 16:54:43,283,2,5.0,0,110.0,489.0,0,1,1,0,To try and see if we can determine future events based off the past and to see how good an estimate it can be
1287,2023-02-04 16:49:54,2023-02-04 16:54:44,290,4,10.0,1,102.0,1501.0,0,0,0,1,To predict the day of the peak day and peak number of incidents based on a graph.
5165,2023-02-04 16:48:08,2023-02-04 16:54:48,399,1,5.0,1,164.0,2370.0,1,1,1,0,Provide a prediction of two quantities
4872,2023-02-04 16:51:30,2023-02-04 16:54:51,200,2,2.5,0,85.0,1300.0,0,0,0,1,estimate peak day and peak time of an outbreak
2225,2023-02-04 16:50:48,2023-02-04 16:55:03,254,3,2.5,0,100.0,2000.0,1,1,0,0,The goal of the study was to show data for a  fictitious outbreak or epidemic. I was to use this data from this season and the previous two seasons to predict peak infection day and rate.
578,2023-02-04 16:39:45,2023-02-04 16:55:57,972,-2,5.0,0,160.0,1300.0,0,1,1,0,"I think they want to know the way we read the charts perhaps, or the predictions we make based on these charts."
3535,2023-02-04 16:53:47,2023-02-04 16:56:09,142,2,10.0,0,65.0,1378.0,1,1,1,0,To estimate when the peak of the pandemic would be and how many people would get sick.
1913,2023-02-04 16:52:24,2023-02-04 16:56:39,255,-2,10.0,1,100.0,1100.0,0,1,0,0,To generate 2 predictions about a potential epidemic. To gauge how understandable a potential graph is showing various data points.
2668,2023-02-04 16:53:26,2023-02-04 16:56:59,213,1,5.0,1,180.0,450.0,0,1,1,0,To estimate the peak time and day.
4314,2023-02-04 16:52:37,2023-02-04 16:57:00,262,2,2.5,1,104.0,2684.0,0,0,0,1,To learn more about how I interacted with the information
4129,2023-02-04 16:51:29,2023-02-04 16:57:15,345,3,10.0,1,56.0,1500.0,1,1,1,0,It was two estimate hypothetical peak date of a endemic and number of cases.
3846,2023-02-04 16:53:29,2023-02-04 16:57:31,241,-2,10.0,0,80.0,1200.0,1,1,0,0,To see what our prediction would be regarding what we thought would be the peak day and the hospitalizations on that day
