PID,startdate,enddate,duration,week,noise,model_included,peak_time,peak_intensity,factors__current_season,factors__past_season,factors__past_season2,factors__model,survey_summary_from_participant
1109,2023-02-04 19:45:00,2023-02-04 19:51:12,372,4,2.5,1,144.0,675.0,0,0,0,1,To predict an epidemic's peak. Also measured in hospitalizations.
782,2023-02-04 19:47:59,2023-02-04 19:51:21,201,3,10.0,1,90.0,1000.0,1,1,1,1,Find the peak day and amount of hospitalizations
1808,2023-02-04 19:39:57,2023-02-04 19:51:42,704,3,2.5,0,59.0,173.0,1,1,1,0,The goal of the study was to see how people read graphs and charts and make inferences based on the information given.
1992,2023-02-04 19:50:02,2023-02-04 19:52:16,134,4,5.0,1,57.0,1666.0,1,1,0,1,The surveillance system could only estimate a certain number of hospitalizations but I had to analyze the data and try to find an underlying trend that was responsible for the changes between peak days.
5196,2023-02-04 19:45:15,2023-02-04 19:52:32,436,1,10.0,0,140.0,1000.0,1,1,1,0,Determine the amount of hospitalizations on the peak of the infection.
2970,2023-02-04 19:47:52,2023-02-04 19:54:11,378,3,5.0,0,90.0,1400.0,1,1,1,0,To generate predictions about a possible epidemic using past and present data.
1178,2023-02-04 19:51:24,2023-02-04 19:54:23,179,-2,10.0,0,89.0,1123.0,1,0,0,0,To identify where the peak time and number of hospitalizations in the data
4832,2023-02-04 19:46:42,2023-02-04 19:54:25,462,1,2.5,0,3.0,640.0,1,0,0,0,How people read graphs
978,2023-02-04 19:51:36,2023-02-04 19:54:29,172,1,10.0,1,84.0,1600.0,1,0,0,1,To estimate how what peak infections would be and on what day in a hypothetical outbreak.
4852,2023-02-04 19:49:25,2023-02-04 19:54:49,323,-2,2.5,0,57.0,64.0,1,0,0,0,reading a graph and predicting the outcome based on plotted facts
2117,2023-02-04 19:52:59,2023-02-04 19:54:56,117,2,10.0,0,72.0,336.0,1,0,1,0,The goal of this study was to find out how well participants could read a multi-variable graph according to demographic.
5285,2023-02-04 19:33:48,2023-02-04 19:55:09,1280,2,2.5,1,115.0,400.0,1,1,1,1,"I guess it was to see if we thought the peak would be lower or higher than previous seasons, and whether the curve would be broader thant last season (and the first season). "
401,2023-02-04 19:49:56,2023-02-04 19:55:28,331,2,10.0,0,59.0,1454.0,1,1,0,0,
5915,2023-02-04 19:49:48,2023-02-04 19:55:33,344,-2,2.5,1,200.0,425.0,1,1,1,0,To see when we would decide peak day and hospitalization number based on previous data.
5009,2023-02-04 19:48:26,2023-02-04 19:55:41,434,2,2.5,1,56.0,200.0,1,0,1,0,The goal of this study is to gain insight into the estimates that participants make based on historical and forecast data. It tries to determine which data sets the participants choose when making their estimates.
2606,2023-02-04 19:47:25,2023-02-04 19:55:55,509,3,2.5,1,101.0,1990.0,1,1,0,0,to predict the peak day of a infectious disease and the number of hospitalization on that peak day using a chart provided which consisted of the various data points including current and past.
2438,2023-02-04 19:51:29,2023-02-04 19:56:05,275,1,5.0,0,69.0,137.0,0,1,1,0,"To determine, via graph, what the peak day of the pandemic will be, and how many people will be hospitalized that day."
3303,2023-02-04 19:53:05,2023-02-04 19:57:22,257,4,10.0,1,56.0,1490.0,0,0,1,1,I believe it was for me to take into consideration the past seasons as well as the prediction in pink. Then I was to decide which would probably be the peak day and the number of cases.
2863,2023-02-04 19:54:48,2023-02-04 19:57:33,165,1,2.5,1,79.0,955.0,1,0,0,0,To see how well people can read graphs when it comes to comparing multitudes of research. 
4247,2023-02-04 19:55:31,2023-02-04 19:57:33,122,-2,2.5,1,57.0,64.0,0,0,1,0,To observe data based on an infectious agent that caused an outbreak - this measured the peak at which the outbreak was the strongest.
3747,2023-02-04 19:52:16,2023-02-04 19:57:39,323,3,10.0,1,180.0,30.0,1,1,0,0,To look at predictions and incidence of a potential infectious disease and how that information can be used in observations.
3,2023-02-04 19:55:10,2023-02-04 19:57:45,155,4,5.0,0,2349.0,1404.0,0,1,0,0,I think they were measuring opinions of participants. Especially in regards to hospitalization numbers 
1714,2023-02-04 19:37:49,2023-02-04 19:57:53,1204,4,2.5,1,98.0,1000.0,1,1,1,0,"To study how skilled people are at reading graphs, and if the fact that its concerning an infectious agent will impact people's predictions about the number of hospitalizations."
5649,2023-02-04 19:55:16,2023-02-04 19:58:13,176,2,2.5,0,73.0,72000.0,1,0,0,0,I am not really sure. 
2730,2023-02-04 19:55:14,2023-02-04 19:58:33,199,4,2.5,1,70.0,2000.0,0,1,1,0,The goal was to see the peak day of the infection. It was to calculate.
5501,2023-02-04 19:55:26,2023-02-04 19:58:50,203,1,5.0,0,57.0,62.0,0,0,0,1,To see how people would choose the highest peak on the chart?
3802,2023-02-04 19:51:09,2023-02-04 19:58:59,469,3,2.5,0,70.0,200.0,0,0,1,0,I think the purpose of this study is to see people's perceptions of outbreaks.
3829,2023-02-04 19:55:51,2023-02-04 19:59:20,208,-2,10.0,0,93.0,940.0,1,0,0,0,To make an estimation using the provided surveillance data about when the epidemic peak was and how many hospitalizations there were because of it
2373,2023-02-04 19:47:41,2023-02-04 19:59:20,698,-2,5.0,1,84.0,950.0,1,0,0,0,"The study wanted to look at how accurate a person's judgement is  when interpreting data. So, I believe you will look at actual data and our predictions and see how close a regular person is in determining the peak hospitalizations and number hospitalized is to actual data.  Somehow, you will use this to predict outcomes of pandemics in the future. "
3600,2023-02-04 19:58:48,2023-02-04 20:00:17,89,-2,5.0,0,84.0,1300.0,1,0,0,0,to see how well we could analyze data
2584,2023-02-04 19:56:12,2023-02-04 20:01:23,310,2,10.0,1,90.0,60.0,1,0,0,1,How people different estimates? If other period samples or current data similarities to model outcomes effect their guessed predictions more. 
2242,2023-02-04 19:52:03,2023-02-04 20:02:48,644,1,2.5,1,79.0,755.0,1,0,0,0,Try to find peak of an epidemic 
522,2023-02-04 19:57:18,2023-02-04 20:03:12,353,-2,2.5,0,89.0,1670.0,1,0,0,0,To see if people are able to correctly interpret a graph with multiple data sets included on it.
2230,2023-02-04 19:58:33,2023-02-04 20:04:39,365,3,2.5,1,84.0,324.0,1,1,0,1,I was asked to predict which day the peak day would hit and how many hospitalizations there would be. I was allowed to look at a chart.
740,2023-02-04 20:00:58,2023-02-04 20:05:14,256,2,2.5,1,55.0,1950.0,0,0,1,0,How people use data to predict future outcomes
2006,2023-02-04 20:02:46,2023-02-04 20:05:25,159,2,5.0,1,58.0,1066.0,0,0,1,0,To determine the peak sick day at the hospital based on prior data
1946,2023-02-04 19:52:59,2023-02-04 20:05:34,754,3,5.0,1,200.0,1800.0,0,0,1,0,"The goal of the study was for us to make a prediction on what day will the pandemic be at its worst, and how many people will be hospitalized on that day"
3798,2023-02-04 20:02:59,2023-02-04 20:05:40,160,-2,5.0,1,1600.0,56.0,1,0,1,0,The goal of the study was to see how we interpret information.
3293,2023-02-04 19:56:57,2023-02-04 20:06:07,549,4,2.5,0,168.0,345.0,1,1,1,0,The goal of this study was to take the data from the last two epidemic seasons and use that data to predict what the next potential epidemic numbers could be. What the peak day would be and the incident hospitalizations would be.
1029,2023-02-04 20:03:25,2023-02-04 20:06:25,180,1,2.5,0,56.0,1950.0,1,0,1,0,"The goal of this study was to try to determine what day, during the course of two seasons, there were the most hospitalizations, for an epidemic."
5974,2023-02-04 19:59:01,2023-02-04 20:07:16,494,4,10.0,0,57.0,1465.0,0,0,1,0,to summarize the number of hospitalizations in a given seasons for a possible epidemic.
1114,2023-02-04 20:01:41,2023-02-04 20:07:19,337,4,5.0,1,114.0,700.0,0,0,0,1,To determine the estimated peak day and number of incidents of an epidemic for this season.
2964,2023-02-04 19:53:23,2023-02-04 20:07:29,845,3,5.0,1,100.0,2000.0,1,1,1,1,Make a prediction of the peak number of hospitalizations and the day of the epidemic the peak will occur.
3281,2023-02-04 20:03:08,2023-02-04 20:07:34,265,-2,2.5,1,109.0,195.0,0,0,0,1,
1174,2023-02-04 20:02:55,2023-02-04 20:08:07,311,2,5.0,1,200.0,2000.0,1,0,0,0,"In order to make two predictions about this prospective pandemic, it is crucial to concentrate on the moment when the underlying trend in hospitalizations peaks and its peak value."
3116,2023-02-04 19:53:45,2023-02-04 20:08:25,880,3,5.0,0,83.0,1374.0,1,1,1,0,To see how well people could extrapolate data. 
542,2023-02-04 20:03:03,2023-02-04 20:08:28,324,1,10.0,0,180.0,1000.0,0,1,0,0,The most crucial concept is to concentrate on the period of time and peak value of the underlying trend in hospitalizations and to provide two forecasts about this prospective pandemic.
5718,2023-02-04 20:05:56,2023-02-04 20:09:06,189,3,2.5,1,59.0,173.0,1,0,0,0,I have no idea. I read the instructions three times and was still not 100% sure of which part of the graph was useful and which part of the graph was fugazzy 
4892,2023-02-04 20:08:38,2023-02-04 20:09:54,76,-2,5.0,0,57.0,1666.0,0,1,1,0,to show how many hospitalizations occured on each day
2907,2023-02-04 19:57:33,2023-02-04 20:10:08,754,1,10.0,0,57.0,1450.0,1,1,1,1,to predict peak hospital visits
3502,2023-02-04 20:04:06,2023-02-04 20:10:10,363,1,5.0,0,57.0,1666.0,0,0,1,0,To determine how individuals look into the graphed data and different analytical sources. There were a few ways in which one could decide on their answer in this study and I imagine those thought process will be analyzed.
5144,2023-02-04 20:02:40,2023-02-04 20:10:10,450,1,10.0,1,98.0,1400.0,1,1,1,0,The goal was to see if using predictions from humans combined with predictions from models you can come up with more accurate predictions to help make public health decisions about an epidemic.
1459,2023-02-04 20:05:17,2023-02-04 20:10:31,314,-2,2.5,0,89.0,1670.0,1,0,1,0,"Considering that there is an ""model in read"" if available option, I would estimate that the study aims to determine if people are better at predicting data when given extra tools."
2280,2023-02-04 20:04:34,2023-02-04 20:10:39,364,4,5.0,0,57.0,62.0,1,1,1,0,The ability of individuals to estimate based on graphic models.
5176,2023-02-04 20:07:53,2023-02-04 20:11:36,223,3,10.0,0,50.0,70.0,1,1,1,0,"To see if you can predict when the current season has it's peak. I looked at the previous season, then compared it to the current prediction and tried to imagine how the numbers would look like when comparing the two. I thought that the number of hospitalizations in the current season may be higher, like a quick spike, but over a shorter time period."
3022,2023-02-04 19:52:05,2023-02-04 20:13:34,1288,1,2.5,0,130.0,1700.0,1,0,0,0,The ability to read graphs.  The ability to postulate future data from existing data.
2628,2023-02-04 20:09:08,2023-02-04 20:13:41,272,2,10.0,0,90.0,600.0,1,1,0,0,To estimate the peak of an infection 
4255,2023-02-04 20:06:04,2023-02-04 20:14:12,488,1,5.0,1,79.0,650.0,1,1,1,0,It may have been a study to see if people can extrapolate from previous data.
3816,2023-02-04 20:06:17,2023-02-04 20:15:03,525,-2,5.0,1,93.0,1000.0,0,1,1,0,To estimate when peak hospitalizations will occur and how many are predicted to occur.
1632,2023-02-04 20:12:18,2023-02-04 20:15:20,181,3,5.0,0,120.0,1000.0,1,1,0,0,To estimate the number of days to peak infection and quantity infected
1919,2023-02-04 20:10:53,2023-02-04 20:16:43,349,3,10.0,1,102.0,1700.0,0,1,1,0,i about the forecast of hospitalization on a particular day.
2296,2023-02-04 20:06:36,2023-02-04 20:16:46,609,2,10.0,1,86.0,1500.0,1,1,1,1,the goal of this study was to see if the general public can accurately predict the trajectory of a potential epidemic when given certain sets of data.
2069,2023-02-04 20:10:47,2023-02-04 20:17:14,386,4,2.5,1,70.0,120.0,0,0,0,1,To see how accurate the predictions people make about epidemics are based on existing data and confusing/under-explained infographics.
4991,2023-02-04 20:13:13,2023-02-04 20:17:48,274,2,2.5,0,84.0,130.0,1,1,1,0,Make a prediction of the peak day and how many hospitalizations of a fictitious infectious agent. 
4624,2023-02-04 20:17:16,2023-02-04 20:18:53,96,-2,10.0,0,98.0,1200.0,1,0,0,0,The goal of the study is to see how well I can take data and make predictions based on it.
2914,2023-02-04 19:59:14,2023-02-04 20:19:15,1201,2,5.0,0,65.0,450.0,1,0,0,1,The goal of the study was to look at a graph of fictional data and predict what a peak day in the graph would be. The goal was also to see what data we took into account to make our decisions. 
1214,2023-02-04 20:17:35,2023-02-04 20:20:15,160,4,5.0,0,57.0,62.0,0,0,1,0,The study was about data presented for incident hospitalizations caused by an infectious agent. It predicted data on days and hospitalizations
3910,2023-02-04 20:09:33,2023-02-04 20:20:23,650,2,2.5,1,80.0,425.0,0,1,1,1,"Using past data and models predict peak infection date and peak incidents. (Even though question above says ""time"".)"
3069,2023-02-04 20:18:25,2023-02-04 20:20:25,119,1,10.0,0,90.0,500.0,1,1,1,0,
1735,2023-02-04 20:19:00,2023-02-04 20:21:29,149,4,2.5,1,72.0,611.0,0,1,1,0,The goal was to see if people can read charts.
1447,2023-02-04 20:18:08,2023-02-04 20:22:26,258,3,2.5,1,57.0,64.0,1,0,1,0,"Was to see how people can infer data from charts. And, or potential epidemics."
189,2023-02-04 20:20:31,2023-02-04 20:22:29,117,1,5.0,0,98.0,1000.0,1,1,1,0,To estimate the number of hospitalizations from epidemics caused by an infectious agent.
1377,2023-02-04 20:08:04,2023-02-04 20:22:40,875,-2,10.0,0,160.0,250.0,0,0,0,1,"The goal was to give a prediction of the number of days for the pandemic to reach its peak for the current season and number of new hospitalizations on that day, by using the data from the past two seasons."
3244,2023-02-04 20:18:48,2023-02-04 20:22:40,232,2,5.0,1,95.0,1750.0,1,1,1,1,Evaluating how people predict the impact of a pandemic when presented with a graph of info.
4166,2023-02-04 20:16:44,2023-02-04 20:23:17,392,4,5.0,1,84.0,1000.0,1,1,0,1,To forecast hospitalizations and when they would happen based on past data
5476,2023-02-04 20:19:56,2023-02-04 20:23:21,204,-2,2.5,0,8.0,1670.0,1,0,0,0,To figure out how people interpret graphs.
5095,2023-02-04 20:18:44,2023-02-04 20:23:30,286,4,5.0,1,100.0,1500.0,0,1,1,1,The goal of this study was to see how people understand graphs and data.
4745,2023-02-04 20:15:05,2023-02-04 20:24:05,540,1,2.5,1,83.0,2000.0,1,1,1,1,To see what day the peak of the epidemic would be. Also to see how many people would be hospitalized at the peak of the epidemic
4911,2023-02-04 20:21:08,2023-02-04 20:25:31,263,2,10.0,0,98.0,700.0,1,1,1,0,Based on historical trends how we would estimate current trends based on our own judgements
3905,2023-02-04 20:22:12,2023-02-04 20:25:52,220,-2,5.0,0,115.0,1000.0,1,1,1,0,The goal was to determine how we interpret accuracy of surveillance data for a fictitious epidemic.
4332,2023-02-04 20:21:05,2023-02-04 20:27:08,362,1,5.0,1,50.0,1666.0,1,1,0,0,The peak number of hospitalizations and also the number of days
907,2023-02-04 20:24:55,2023-02-04 20:27:19,143,2,2.5,0,86.0,512.0,1,1,1,0,To see how accurately we could predict the peak of the infections and how many infections would be hospitalized. 
5231,2023-02-04 20:21:42,2023-02-04 20:27:38,356,4,10.0,1,150.0,1200.0,1,1,0,0,
5137,2023-02-04 20:24:57,2023-02-04 20:27:53,176,3,10.0,0,64.0,133.0,1,0,0,0,The goal of this study was to study the pattern of incident hospitalizations caused by this infectious agent. The goal for me was to analyze the data provided.
923,2023-02-04 20:24:09,2023-02-04 20:28:19,249,3,10.0,1,98.0,1206.0,0,1,1,1,"see how good the average schmoe is at interpreting data
"
2663,2023-02-04 20:22:19,2023-02-04 20:28:52,392,-2,10.0,1,110.0,1600.0,1,1,1,1,estimate / predict the day of peak and the number of people in hospitals
5350,2023-02-04 20:27:38,2023-02-04 20:29:31,113,2,10.0,0,114.0,900.0,1,1,1,0,To provide an estimation of a pandemic
4054,2023-02-04 20:21:44,2023-02-04 20:29:37,472,-2,2.5,1,113.0,900.0,1,1,0,0,The goal of this study was to measure hospitalizations based on past seasons.  
3678,2023-02-04 20:22:12,2023-02-04 20:29:37,445,1,2.5,0,75.0,750.0,1,1,1,0,To generate two predictions based on data provided about a ficticious potential pandemic. 
2777,2023-02-04 20:21:20,2023-02-04 20:30:07,526,2,10.0,1,118.0,518.0,0,0,1,0,The goal of the study was to observe how people read information from data presented in graphical form. Then how these information is used to make estimations by various people.
756,2023-02-04 20:26:14,2023-02-04 20:30:20,246,4,10.0,0,56.0,44.0,1,0,1,0,Using the chart on how to get the peak day. Once you got the peak days we had to figure out hope many hospitals. 
4508,2023-02-04 20:28:16,2023-02-04 20:30:32,136,4,2.5,1,101.0,1892.0,0,0,0,1,"To look at data about time and hospital incidences, and make an estimate about an epidemic."
4445,2023-02-04 20:21:52,2023-02-04 20:31:24,572,2,5.0,0,100.0,750.0,1,1,0,0,The estimation of incident hospitalizations was a goal. The other was determining the day of the maximum. 
5582,2023-02-04 20:28:02,2023-02-04 20:32:18,255,3,5.0,1,85.0,2360000.0,1,1,1,1,"Other than trying to predict when it would peak, I have no idea."
5184,2023-02-04 20:25:50,2023-02-04 20:32:51,420,2,2.5,1,57.0,64.0,0,0,1,0,To compare predicted vs actual hospitalizations
3277,2023-02-04 20:08:24,2023-02-04 20:33:27,1503,4,10.0,0,135.0,150.0,1,1,1,0,To predict when the epidemic will reach its peak point and how many hospitalizations will there be. We gather our predictions based on the graph shown with the data from 2 seasons ago and last season.
1221,2023-02-04 20:31:15,2023-02-04 20:33:37,141,1,5.0,0,57.0,62.0,1,1,0,0,To infer the epidemic trends from past seasons and when it will peak
1953,2023-02-04 20:31:37,2023-02-04 20:33:44,126,4,10.0,1,90.0,500.0,1,1,0,1,predict hospitalizations from virus
3703,2023-02-04 20:27:20,2023-02-04 20:33:46,386,2,5.0,0,156.0,2100.0,0,0,1,0,Guessing the peak and hospitalization of an epidemic 
4909,2023-02-04 20:31:01,2023-02-04 20:33:56,175,2,2.5,1,19.0,42.0,1,1,0,0,to find out what the peak days are
3484,2023-02-04 20:28:48,2023-02-04 20:34:29,341,3,5.0,0,180.0,500.0,0,0,0,1,To predict the spread of a pandemic and to predict hospitalization numbers at the peak.
609,2023-02-04 20:31:27,2023-02-04 20:34:31,183,3,10.0,0,56.0,1500.0,0,0,1,0,The goal was to guess what the numbers would be on the peak day depending on the graph predictions 
747,2023-02-04 20:23:32,2023-02-04 20:34:46,673,3,2.5,0,85.0,432.0,1,1,1,0,Figure out the peak about of deaths in one day and when that day would take place.
572,2023-02-04 20:32:24,2023-02-04 20:35:10,166,1,2.5,0,79.0,955.0,1,0,0,0,The goal of the study was to estimate the peak day and estimated number of hospitalizations for a potential pandemic disease.
2461,2023-02-04 20:30:20,2023-02-04 20:35:34,313,3,2.5,1,62.0,114.0,1,1,1,0,Trying to understand how people interrupt data and what influences their predictions.  
3865,2023-02-04 20:30:51,2023-02-04 20:35:39,288,1,2.5,1,93.0,2500.0,1,1,1,1,"Based on epidemic hospitalization data from this season and the past two seasons, estimate when the peak will be and how many hospitalizations it will be."
1611,2023-02-04 20:29:26,2023-02-04 20:36:24,418,-2,5.0,0,50.0,30.0,0,0,1,0,freedom of evaluation
357,2023-02-04 20:32:38,2023-02-04 20:36:47,248,-2,2.5,0,90.0,1500.0,1,1,1,0,To find the best guess for the worst day in a pandemic.
5948,2023-02-04 19:35:23,2023-02-04 20:37:13,3710,-2,5.0,1,123.0,1541.0,1,1,1,0,To see our best estimate on percentiles using multiple sources of data.
3008,2023-02-04 20:35:14,2023-02-04 20:37:16,122,-2,10.0,0,59.0,115.0,1,1,1,1,Guess the peak day and how many hospitlizations hapened.
4321,2023-02-04 20:36:09,2023-02-04 20:37:34,84,1,5.0,1,154.0,1200.0,0,0,0,1,Read a map
4036,2023-02-04 20:23:29,2023-02-04 20:38:09,879,-2,2.5,1,107.0,1900.0,0,1,1,1,To see what data people based their predictions on.
3273,2023-02-04 20:32:07,2023-02-04 20:38:14,367,4,5.0,1,98.0,500.0,1,1,1,0,The goal of the study was to how people make predictions.
5385,2023-02-04 20:35:26,2023-02-04 20:38:49,202,1,10.0,1,59.0,115.0,0,0,1,0,To analyze about forecasting incident given the graph data.
3300,2023-02-04 20:34:12,2023-02-04 20:38:53,281,4,10.0,0,110.0,700.0,1,1,1,0,To understand how people use old data trends and compare to new trends.
2142,2023-02-04 20:21:13,2023-02-04 20:39:04,1071,1,10.0,1,182.0,200.0,0,1,1,0,Predict the peak day and time of hospitalizations for a potential epidemic of a fictitious disease.
4365,2023-02-04 20:26:29,2023-02-04 20:39:07,757,1,10.0,0,60.0,464.0,0,1,1,0,"Forecast the peak spread of infection and hospitalization with time using 3 data sets (2 historical confirmed and 1 hypothetical simulation) . The strongest evidence of 2 seasons together, the most recent real last season and the simulated spread episode of infections."
2592,2023-02-04 20:37:50,2023-02-04 20:39:28,97,3,2.5,1,12.0,2500.0,1,0,0,0,to see when was the peek of hospitalizations
719,2023-02-04 20:32:27,2023-02-04 20:39:29,422,2,10.0,1,91.0,1965.0,1,1,1,1,I needed to analyze data on the current season and past two seasons of hospitalizations due to an epidemic. After processing said data I needed to predict the peak of the current season's outbreak.
3945,2023-02-04 20:37:48,2023-02-04 20:40:34,165,-2,2.5,0,56.0,1995.0,0,0,1,0,Estimating peak day and time. 
1222,2023-02-04 20:26:54,2023-02-04 20:40:57,843,-2,10.0,1,89.0,1123.0,1,0,0,0,"I looked at the highest blue dot, as the next ones were all lower."
1130,2023-02-04 20:36:10,2023-02-04 20:41:16,305,1,5.0,0,87.0,1250.0,1,1,1,0,To see whether you can predict a pandemic based on previous season data. Can you extrapolate accurately from trends observed in the past.
1587,2023-02-04 20:37:40,2023-02-04 20:41:18,217,4,2.5,1,100.0,1900.0,1,0,0,1,The goal was to see how accurately people could forecast given some data 
5573,2023-02-04 20:25:26,2023-02-04 20:41:23,957,3,5.0,1,127.0,777.0,1,0,1,0,"The objective of this study was to look to charts, graphs, and data measuring the patterns of an infectious agent's effect on communities that resulted in incidents of sickness that led to hospitalizations and then taking the observations made during studying this data and make two predictions: 1] A guess at when and what day the hospitilization incidents from this cause was at the max peak from the numbers recorded thus far 2] What that peaking number of incidents was liikely to be on this peak day."
3817,2023-02-04 20:32:53,2023-02-04 20:41:24,511,4,2.5,0,51.0,40650.0,1,0,0,0,The goal of the study was to see how someone would determine the peak day and hospitalization numbers of a hypothetical pandemic.
4374,2023-02-04 20:34:01,2023-02-04 20:42:08,486,1,5.0,1,98.0,1000.0,1,1,1,1,"I am not sure what the researcher's goal was, but my task was to examine the plot graph of an epidemic and predict the peak day and the # of hospitalizations on that peak day."
2551,2023-02-04 20:37:11,2023-02-04 20:42:11,299,2,5.0,0,71.0,231.0,1,0,0,0,im not sure
5090,2023-02-04 20:32:35,2023-02-04 20:42:51,615,1,10.0,1,86.0,1500.0,1,0,1,1,The goal is to combine human input on epidemic estimates with AI/computer generated esitmates to hopefully get a better understanding/ and estimates on future epidemics.
3473,2023-02-04 20:37:48,2023-02-04 20:43:35,346,2,2.5,1,112.0,2500.0,0,0,0,1,The goal of this study was to predict future hospitalizations based on previous data
3333,2023-02-04 20:40:11,2023-02-04 20:43:48,216,1,2.5,1,118.0,902.0,0,1,0,0,The goal of the study was to predict hospitalizations. We used current and previous seasons to help forecast our estimates.
167,2023-02-04 20:39:51,2023-02-04 20:44:05,253,3,5.0,0,127.0,399.0,1,1,0,0,The goal was to determine when an infectious disease's peak day with the most hospitalizations would be based on graphical data provided.
3856,2023-02-04 20:43:47,2023-02-04 20:44:14,26,-2,5.0,0,2.0,2.0,0,1,0,0,
5123,2023-02-04 20:42:16,2023-02-04 20:44:44,147,4,10.0,0,55.0,1200.0,0,1,1,0,To see peoples perception's of an epidemic based on chart data.
2595,2023-02-04 20:42:37,2023-02-04 20:44:48,131,4,5.0,1,57.0,62.0,1,0,1,0,To determine hospitalization 
1047,2023-02-04 20:33:38,2023-02-04 20:45:22,703,-2,10.0,0,93.0,940.0,1,1,0,0,The goal of the study was to forecasting incident hospitalizations caused by a fictitious infectious agent.
3948,2023-02-04 20:42:32,2023-02-04 20:45:54,201,3,10.0,0,90.0,200.0,1,1,0,0,How people interpret and read data from graphs.
594,2023-02-04 20:44:14,2023-02-04 20:45:56,101,3,5.0,1,112.0,2300.0,0,0,0,1,The goal was to predict a incident based off numbers and stats provided.  We had to estimate if it would be in line with the provided information or if it would delve from it.
5623,2023-02-04 20:44:28,2023-02-04 20:46:08,99,1,10.0,0,-11.0,120.0,0,1,0,0,How many hospitalizations during a pandemic.
2074,2023-02-04 20:45:36,2023-02-04 20:47:07,90,3,10.0,1,64.0,133.0,0,1,1,0,To determine how people view projected data on a subject with recent bias.
2398,2023-02-04 20:32:04,2023-02-04 20:47:31,927,2,2.5,0,100.0,100.0,1,1,1,0,"The goal was to predict the day of the spike, which is the maximum number of hospitalizations, of the current season's epidemic. It is also to predict the number of hospitalizations on that day."
883,2023-02-04 20:43:51,2023-02-04 20:48:25,273,4,5.0,0,57.0,1666.0,0,1,0,0,predictions
1663,2023-02-04 20:44:47,2023-02-04 20:48:28,221,2,10.0,0,60.0,1500.0,0,1,1,0,It was to use a graph to predict the length and amount of incidents. I then had to guess when the peak was and the number of incidents. 
