PID,startdate,enddate,duration,week,noise,model_included,peak_time,peak_intensity,factors__current_season,factors__past_season,factors__past_season2,factors__model,survey_summary_from_participant
1035,2023-02-04 15:16:02,2023-02-04 15:20:25,262,2,10.0,1,110.0,1700.0,0,0,1,1,To potentially predict when a fictitious infection could affect the most people and how many based on past events. 
51,2023-02-04 15:11:14,2023-02-04 15:20:39,564,3,5.0,1,110.0,700.0,1,1,1,1,To see how we predict an outcome based on the presented data.
1319,2023-02-04 15:17:34,2023-02-04 15:20:44,189,3,10.0,0,70.0,65200.0,1,0,0,0,To predict the peak hospitalizations and peak time of this outbreak.  The virus in the outbreak is fictitious.  
220,2023-02-04 15:18:33,2023-02-04 15:20:46,133,1,5.0,1,150.0,2000.0,1,1,1,1,Gauging a graph and making inferences based on it.
884,2023-02-04 15:09:22,2023-02-04 15:20:58,695,2,10.0,1,56.0,1500.0,0,0,1,0,understanding graphs
125,2023-02-04 15:05:35,2023-02-04 15:21:01,925,4,2.5,1,114.0,43.0,0,1,1,0,To predict the outcome of a fictitious disease based on data collected from a surveillance system. To help us come to a decision we were provided a data graph that contained statistics from previous outbreaks and expert predictions.
3181,2023-02-04 15:18:38,2023-02-04 15:21:02,144,2,2.5,0,210.0,33.0,0,0,1,0,To see if we could figure out Prime days for an epidemic 
5773,2023-02-04 15:11:26,2023-02-04 15:21:08,582,-2,10.0,0,107.0,1992.0,1,1,1,1,To see how the public understands statistics 
3683,2023-02-04 15:09:50,2023-02-04 15:21:12,682,1,5.0,1,94.0,897.0,0,1,1,0,My goal was to predict the peak day and the number of hospitalizations for this fictitious infection. I'm not really sure what the goal of the study is.
135,2023-02-04 15:18:34,2023-02-04 15:21:14,160,2,2.5,1,60.0,3000.0,1,1,0,1,Due to the fact that the graph shows that there is two peaks in the graph. It also tells us how the model works by itself.
1590,2023-02-04 15:18:15,2023-02-04 15:21:15,180,3,2.5,0,56.0,2000.0,1,0,0,0,To show how a graph can predict the outcome of a pandemic 
5877,2023-02-04 15:15:59,2023-02-04 15:21:24,324,3,10.0,0,87.0,600.0,1,1,1,0,I was asked to find the peak day of an imaginary epidemic based on current and previous fictional data
5726,2023-02-04 15:19:07,2023-02-04 15:21:27,140,3,2.5,1,69.0,50.0,1,1,1,1,The highest peaks for the charted information subsequent to the data provided on behalf of the science.
2393,2023-02-04 15:17:34,2023-02-04 15:21:27,233,2,10.0,0,72.0,336.0,0,1,0,0,To see how past data predicts future hospitilizations.
5102,2023-02-04 15:15:37,2023-02-04 15:21:42,365,3,10.0,1,60.0,200.0,1,1,1,1,"To see if a human, using previous real data and simulated data, could predict when there would be a peak in cases and how many cases would occur at that time.  "
3020,2023-02-04 15:17:53,2023-02-04 15:21:45,232,-2,2.5,1,98.0,2100.0,1,1,0,0,"It was to interpret data regarding a fictional health situation, and see what I as the study participant saw as the peak day and the number of hospitalizations on that day."
3793,2023-02-04 15:19:57,2023-02-04 15:21:52,114,2,10.0,1,56.0,1500.0,1,1,1,1,To identify which day is has the most hospitalizations on average.
5513,2023-02-04 15:18:37,2023-02-04 15:21:56,199,3,10.0,1,102.0,1800.0,1,0,0,1,"The goal of this study was for users to predict hospitalizations, both peak and total. A graph was given to help predict the numbers."
4376,2023-02-04 15:20:06,2023-02-04 15:21:56,110,4,5.0,0,57.0,1666.0,1,1,1,1,It was to determine the graph shown earlier. The number of days and hospilazizations of a disease.
1045,2023-02-04 15:18:08,2023-02-04 15:22:04,235,-2,5.0,0,80.0,1000.0,0,1,1,0,I presume to determine public perceptions of epidemics based on recent events and tangible data from different periods; e.g. determining what the public actually thinks would be realistic in these circumstances.
1691,2023-02-04 15:04:38,2023-02-04 15:22:05,1046,4,2.5,0,151.0,521.0,1,1,0,1,The day hospitals will reach a maximum and the number of incidents
627,2023-02-04 15:15:57,2023-02-04 15:22:11,374,3,10.0,1,78.0,836.0,0,1,1,0,"to predict a potential epidemic at its highest peak , with number hospitalizations"
5263,2023-02-04 15:19:47,2023-02-04 15:22:20,152,2,5.0,1,57.0,1666.0,0,1,1,0,"The goal was to see the data of a fake epidemic, and giving out an estimate"
3790,2023-02-04 15:19:37,2023-02-04 15:22:30,172,3,5.0,1,98.0,2300.0,0,0,0,1,To predict when the fake infectious agent will peak and how many hospitalizations it will cause. 
825,2023-02-04 15:15:33,2023-02-04 15:22:35,422,-2,2.5,0,89.0,1670.0,1,0,0,0,To see if people are good at predicting future trends using charts. (I am not an expert at this type of chart so this was my best guess)
3382,2023-02-04 15:15:10,2023-02-04 15:22:38,448,4,10.0,1,98.0,1460.0,0,1,1,1,The goal of the study was to make a prediction of the peak day of a fictitious infection. It was also to include the peak of the number of infections on that day. 
54,2023-02-04 15:18:52,2023-02-04 15:22:43,230,-2,2.5,1,120.0,900.0,0,1,0,0,"To estimate how severe hospitalization would be for an imaginary infection, given prior data to make an estimate."
449,2023-02-04 15:20:11,2023-02-04 15:22:56,164,-2,10.0,1,95.0,109.0,0,0,1,0,incadents
238,2023-02-04 15:19:07,2023-02-04 15:22:57,230,3,10.0,0,100.0,500.0,1,1,1,0,I believe this is related to covid and trying to gauge rather people believe hospitalizations will continue to go down.  I believe it will be the same as last year but not as bad as the first.
826,2023-02-04 15:20:47,2023-02-04 15:23:02,134,2,10.0,0,59.0,120.0,1,0,1,0,The goal of this study was to estimate the peak day of infections and highest amount of hospitalization due to a fictious disease.
802,2023-02-04 15:20:18,2023-02-04 15:23:04,166,4,5.0,1,194.0,2100.0,0,0,1,0,To try to analyze if predictions can be made off of previous data.identify future trends to prevent future incidents 
3735,2023-02-04 15:20:10,2023-02-04 15:23:06,176,1,10.0,0,90.0,1300.0,1,1,1,0,"Seemed to follow the trend from 2 years ago the closest, so correlated ther two"
4269,2023-02-04 15:21:03,2023-02-04 15:23:17,134,3,2.5,1,115.0,800.0,0,1,0,0,The goal is to see how people make predictions about the future based on past information.
1997,2023-02-04 15:17:56,2023-02-04 15:23:19,323,1,5.0,0,57.0,1666.0,1,1,1,0,To see if I could predict the peak day and hospitalizations of the epidemic using current and past data 
4822,2023-02-04 15:13:49,2023-02-04 15:23:31,581,-2,10.0,0,89.0,1123.0,1,1,0,0,To use past data and current hospitalization observations data to predict the peak of a pandemic.
3410,2023-02-04 15:18:51,2023-02-04 15:23:53,301,2,5.0,0,93.0,750.0,1,1,1,0,To see if we can notice patterns and use them to predict future patterns. 
3664,2023-02-04 15:19:57,2023-02-04 15:23:55,237,-2,2.5,0,56.0,70.0,1,1,1,0,The goal was to ascertain the participant's ability to predict hospitalizations and peak rate of pandemic from a set of data.
3585,2023-02-04 15:21:53,2023-02-04 15:23:55,122,2,2.5,1,104.0,2680.0,0,0,0,1,How people read charts with a high amount of information on them
1186,2023-02-04 15:20:36,2023-02-04 15:23:55,199,4,5.0,0,93.0,1300.0,1,1,0,0,To try to make an educated guess based off old data?
528,2023-02-04 15:17:07,2023-02-04 15:23:59,411,1,2.5,0,98.0,1500.0,1,1,1,0,The goal was to estimate hospitalization during a potential pandemic. Data was provided from past events to work with.
4506,2023-02-04 15:22:42,2023-02-04 15:24:00,78,1,10.0,1,2210.0,1000.0,0,0,1,0,Get the peak and the lasting time
4040,2023-02-04 15:18:53,2023-02-04 15:24:02,309,3,5.0,0,56.0,1900.0,1,0,1,0,To summaries the peak amount of hospitalization and when those peak numbers would  occur in this fictitious scenario of a pandemic 
2190,2023-02-04 15:21:15,2023-02-04 15:24:06,170,-2,5.0,0,65.0,1700.0,1,0,0,0,There was a line chart provided showing days on the x axis and hospital counts in the y axis. I took the provided information into account when make my estimation.
1614,2023-02-04 15:21:06,2023-02-04 15:24:06,179,2,5.0,1,91.0,1900.0,1,1,1,0,The goal of this study was to determine whether or not someone can predict something using these graphs at their disposal
4076,2023-02-04 14:55:22,2023-02-04 15:24:07,1725,4,2.5,0,71.0,50.0,1,1,1,0,Predict the peak levels and hospitalizations this year. 
5293,2023-02-04 15:20:10,2023-02-04 15:24:12,241,1,10.0,0,7.0,1465.0,0,0,1,0,It was seeing if we could read a chart and tell when the peak hospitalizations would occur during the pandemic.  It gave data from a few seasons over many days.
4081,2023-02-04 15:20:14,2023-02-04 15:24:21,247,-2,2.5,1,89.0,1670.0,1,0,0,0,
450,2023-02-04 15:16:21,2023-02-04 15:24:24,482,2,2.5,0,36.0,1350.0,1,1,1,0,The goal of this study is to determine the duration and peak hospitalizations of a fictional infectious disease outbreak.
4452,2023-02-04 15:21:17,2023-02-04 15:24:28,191,2,2.5,0,110.0,625.0,1,1,1,0,The goal was to understand what factors or data individuals commonly use to make predictions.
3870,2023-02-04 15:18:31,2023-02-04 15:24:32,360,1,10.0,1,92.0,986.0,1,1,1,0,Studying how people predict peak infection rates of a virus.
5530,2023-02-04 15:21:24,2023-02-04 15:24:40,195,2,5.0,0,84.0,500.0,1,1,0,0,"To predict hospitalizations this season, using data from previous season."
3192,2023-02-04 15:22:40,2023-02-04 15:24:43,123,-2,5.0,1,59.0,1600.0,1,0,1,0,I don't know
859,2023-02-04 15:17:24,2023-02-04 15:24:45,441,-2,10.0,1,20.0,15.0,0,0,0,1,The goal of the study was to guess the peak number of cases on peak day
4232,2023-02-04 15:20:19,2023-02-04 15:24:48,269,1,5.0,0,130.0,1000.0,1,1,1,0,To make estimates based on past events when the data has changed slightly
4456,2023-02-04 15:11:52,2023-02-04 15:24:52,779,4,5.0,1,154.0,239.0,0,1,1,0,To see what data on graphs the public sees as important. This study is to see how close to scientific pandemic models the general public understands how pandemics happen when provided with the same data. 
2334,2023-02-04 15:17:14,2023-02-04 15:24:54,459,4,5.0,1,98.0,1600.0,0,0,0,1,I think the goal is to test the garph program. the amount of time it took to read the info and reach a decision may also be important
3091,2023-02-04 15:22:07,2023-02-04 15:24:59,172,3,10.0,1,103.0,1710664.0,1,1,0,0,The goal was to predict the day number and cases of the peak level.
4708,2023-02-04 15:22:51,2023-02-04 15:25:03,132,4,10.0,1,108.0,254.0,0,0,0,1,Whether or not I can intrepret data to predict future events.
2288,2023-02-04 15:21:36,2023-02-04 15:25:12,216,1,5.0,1,102.0,907.0,1,1,1,1,I'm not sure what the goal of the study was. I took a guess of what I thought.
875,2023-02-04 15:22:43,2023-02-04 15:25:14,150,2,10.0,1,110.0,700.0,1,1,1,0,The goal of the study was to see how well we could estimate infection rate based on data from previous seasons. 
1713,2023-02-04 15:18:39,2023-02-04 15:25:15,395,3,2.5,1,100.0,2000.0,0,0,1,0,To forecast incidents
178,2023-02-04 15:06:35,2023-02-04 15:25:17,1122,-2,10.0,0,112.0,1100.0,1,1,1,0,"(PS, just so you know you can't disqualify people for comprehension checks) This study was to find out how people thought actually results of an epidemic was compared to hospitalizations from two seasons ago, one season ao, and this season, but only what was caught on surveillance "
1437,2023-02-04 15:19:43,2023-02-04 15:25:21,337,3,5.0,0,118.0,915.0,1,1,1,0,"Using new data from surveillance cameras, based on number of people entering a hospital, use past data to anticipate when the most hospitalized date will be and how many patients will be there."
4929,2023-02-04 15:23:30,2023-02-04 15:25:22,111,3,5.0,1,31.0,1900.0,1,1,1,0,Unsure.
3589,2023-02-04 15:22:13,2023-02-04 15:25:23,190,4,10.0,1,56.0,149000.0,0,0,1,0,To find out what the peak data was and what day. Use the chart to try and find fictitious hospitalizations
425,2023-02-04 15:20:33,2023-02-04 15:25:25,292,3,10.0,0,118.0,136000.0,1,1,1,0,Estimate the peak day and number of hospitalizations of a fictional epidemic based on the previous 2 years and current surveillance.
4368,2023-02-04 15:19:46,2023-02-04 15:25:31,344,1,2.5,1,92.0,830.0,0,0,0,1,I think the goal of this study was to see how (or if) people were able to interpret this data (and its form of presentation) in the way it was intended.
3728,2023-02-04 15:24:18,2023-02-04 15:25:37,78,-2,10.0,1,88.0,1000.0,1,1,1,0,Layperson's understanding of medical data
58,2023-02-04 15:13:33,2023-02-04 15:25:45,731,4,5.0,0,90.0,1500.0,1,1,1,0,"The goal of this study was to estimate the day and the number of incident hospitalizations at which the underlying epidemic of a fictitious infectious agent will reach its highest point (peak), based on noisy data collected by a surveillance system. The study assumed that the epidemic would not peak past 210 days and the number of hospitalizations would not exceed 2,500.
"
3951,2023-02-04 15:24:06,2023-02-04 15:25:49,103,4,2.5,1,56.0,2000.0,0,1,1,0,The goal I think was to interpret how a user identifies the information. 
4635,2023-02-04 15:24:06,2023-02-04 15:25:50,103,3,2.5,1,57.0,64.0,0,0,1,0,the goal of this study was to see whether participants can read the graph and follow instructions
1462,2023-02-04 15:22:40,2023-02-04 15:25:56,195,1,10.0,0,86.0,270.0,1,0,0,0,Predicting hospitalizations based on trends
763,2023-02-04 15:19:54,2023-02-04 15:25:56,362,4,10.0,0,100.0,211.0,1,1,1,0,The goal was to see if people can use graph data to make epidemic predictions.
4033,2023-02-04 15:16:16,2023-02-04 15:26:04,587,3,2.5,0,87.0,178.0,0,1,0,0,To establish the peak day of the outbreak and the number of hospitalizations 
5141,2023-02-04 15:19:23,2023-02-04 15:26:06,402,-2,10.0,0,112.0,1480.0,1,1,0,0,To figure out the peak amount of infections in the future and on what day they occur.
4359,2023-02-04 15:22:18,2023-02-04 15:26:15,237,4,10.0,0,70.0,1450.0,1,0,1,0,The goal was trying to look at the graph. It was also about seeing which goal is the peak.
5639,2023-02-04 15:24:29,2023-02-04 15:26:24,115,1,5.0,1,30.0,600.0,1,1,1,1,"To predict when the worst day of an epidemic would be, along with how many cases there would be on that day."
3736,2023-02-04 15:18:13,2023-02-04 15:26:36,503,-2,10.0,1,96.0,777.0,1,1,1,0,Need to estimate the number of day and the amount of hospitalization from a disease.  Needed to look at historical data.
5927,2023-02-04 15:11:36,2023-02-04 15:26:38,901,4,2.5,0,168.0,110.0,1,1,1,0,Using data for the past two seasons and surveillance estimations to determine data. Predicting the peak day and the number of hospitalizations for a fictitious outbreak.
510,2023-02-04 15:04:14,2023-02-04 15:26:39,1344,2,10.0,0,180.0,1000.0,1,0,0,0,I think the goal of this study is to predict when a virus will reach its full potential. I also think the goal is to estimate how many people could possibly be hospitalized at the virus peak.
3706,2023-02-04 15:23:39,2023-02-04 15:26:43,184,2,5.0,0,59.0,600.0,1,1,1,0,i estimated future hospilizations. i used the graphs data to do so.
989,2023-02-04 15:15:23,2023-02-04 15:26:46,683,-2,2.5,0,100.0,1500.0,1,0,0,0,Figuring out the length of time between incidents and hospitalizations.
4543,2023-02-04 15:22:52,2023-02-04 15:26:51,238,-2,5.0,0,95.0,1450.0,1,1,0,0,I am not sure. I guess you want to see what people consider to be important information?
979,2023-02-04 15:23:20,2023-02-04 15:27:01,221,4,5.0,0,101.0,150.0,1,1,0,0,The goal of this study was to see how we would predict what would happen during an outbreak based on data given to us.
5020,2023-02-04 15:24:27,2023-02-04 15:27:09,161,3,10.0,1,105.0,1700.0,0,0,0,1,to determine the peak number of incidents and on which day we will reach using any of the given graphically forecasted indicators
1603,2023-02-04 15:25:28,2023-02-04 15:27:14,105,4,2.5,0,60.0,1900.0,1,1,0,0,To predict a peak pandemic day
4467,2023-02-04 15:20:55,2023-02-04 15:27:15,379,3,5.0,1,200.0,150.0,1,0,0,0,Forecasting incident hospitalizations caused by a fictitious infectious agent.
4378,2023-02-04 15:17:04,2023-02-04 15:27:17,613,4,2.5,1,98.0,1550.0,0,1,1,0,"The goal of the study was to see where (on what day) the layman or average person thinks a pandemic will reach  peak severity in terms of hospitalizations.  The study also seeks to find how many hospitalizations we think will occur by the time of the peak,"
2488,2023-02-04 15:23:32,2023-02-04 15:27:24,232,3,10.0,0,60.0,601336.0,1,0,1,0,It was to look at the peak of the epidemic using the graph that was given to us. 
3644,2023-02-04 15:21:16,2023-02-04 15:27:27,370,2,10.0,1,84.0,1500.0,0,1,1,0,To predict the peak day (and what volume of incidents) for the potential epidemic. You wanted to assess people's thoughts when looking at the data and how they comprehend it to make a prediction.
4910,2023-02-04 15:25:55,2023-02-04 15:27:30,94,1,10.0,0,64.0,133.0,0,0,1,0,I'm not sure.
2753,2023-02-04 15:13:51,2023-02-04 15:27:32,821,-2,5.0,1,86.0,1300.0,1,1,0,1,The goal was to see how data representation effects a person's ability to predict the peak number of hospitalizations for a potential pandemic.
1333,2023-02-04 15:18:38,2023-02-04 15:27:47,549,4,10.0,1,97.0,1425.0,1,1,1,1,"The goal of this study is to try and ascertain how good the general public is at making epidemiological predictions based on a few key data points. Well, not really the ""general public"", because study-participants aren't exactly a random cross-section of the public, but close enough, right?"
1596,2023-02-04 15:13:02,2023-02-04 15:27:49,887,2,2.5,0,173.0,59.0,0,1,1,0,To predict when the highest incident hospitalizations will occur.
1857,2023-02-04 15:24:28,2023-02-04 15:27:50,201,-2,5.0,1,112.0,2200.0,1,1,1,1,The first goal was to guess the day that was the peak. The second was the number of hospitalizations on the that day. 
2586,2023-02-04 15:25:01,2023-02-04 15:28:05,183,1,2.5,1,79.0,955.0,1,0,0,0,How people make predictions based on chart data
1395,2023-02-04 15:23:02,2023-02-04 15:28:08,305,1,5.0,1,98.0,95.0,0,0,1,0,study the pattern of incident hospitalizations caused by this infectious agent and then provide a prediction of two quantities
4838,2023-02-04 15:21:20,2023-02-04 15:28:13,412,3,2.5,0,182.0,495.0,0,1,1,0,It is trying to find out how people can predict when and how much an incident will occur given data that was gathered about previous incidents.
4810,2023-02-04 15:23:49,2023-02-04 15:28:15,265,2,2.5,0,107.0,210.0,1,1,1,0,Predict the future peak of hospitalizations.
2357,2023-02-04 15:23:33,2023-02-04 15:28:18,284,-2,2.5,0,57.0,1955.0,1,0,0,0,I'm assuming it has to do with reading graphs and making predictable outcome calls.
4782,2023-02-04 15:24:37,2023-02-04 15:28:31,233,-2,10.0,0,110.0,2100.0,1,0,0,0,My view of the data and predictions
4352,2023-02-04 15:22:07,2023-02-04 15:28:46,399,3,5.0,0,112.0,2000.0,1,1,1,0,To determine what day the infections would peak and how many there would be based off of past data.
2348,2023-02-04 15:23:30,2023-02-04 15:28:47,317,2,5.0,0,75.0,875.0,0,1,1,0,To estimate when will be the peak time in the season that has the most hospitalizations.
1116,2023-02-04 15:26:17,2023-02-04 15:28:53,155,-2,10.0,0,55.0,1500.0,1,0,0,0,To find the day where hospitalizations peaked.
4741,2023-02-04 15:23:46,2023-02-04 15:28:52,305,4,5.0,1,100.0,400.0,1,1,1,0,To try and use the model to predict when the peak number of hospitalizations will happen and how many hospillizations will happen on the peak using data for this current season number of hospitalizations and the last two seasons number of hospitalizations as well.
1223,2023-02-04 15:26:49,2023-02-04 15:28:57,128,2,5.0,0,57.0,1750.0,1,1,1,1,to estimate the day of the peak amount of hospitalizations and how many hospitalizations that would be 
2033,2023-02-04 15:25:35,2023-02-04 15:29:04,208,2,10.0,0,89.0,480.0,1,1,1,0,"The goal of the study was to estimate when the peak day would be for an ongoing epidemic. Using information from a graph including current estimates and data from epidemics from two seasons ago, I would also estimate how many infections would occur on that peak day."
1117,2023-02-04 15:18:00,2023-02-04 15:29:07,666,-2,5.0,1,100.0,17041.0,0,0,1,0,To predict the peak day and the number of hospitalizations during a potential epidemic.
2861,2023-02-04 15:21:15,2023-02-04 15:29:29,493,4,2.5,1,80.0,600.0,1,1,1,1,"The goal was to determine if members of the general public (i.e., me) could use information about past/current epidemic trends to forecast the peak day for a current epidemic of the same illness as well as the number of hospitalizations on that day."
4760,2023-02-04 15:25:40,2023-02-04 15:29:31,230,4,5.0,0,63.0,1620.0,1,1,1,0,"To predict the day in which a fictitious pandemic will peak, and how many hospitalizations will occur at that point."
1034,2023-02-04 15:28:39,2023-02-04 15:29:34,54,2,10.0,1,72.0,336.0,1,0,0,0,COVID
2295,2023-02-04 15:23:35,2023-02-04 15:29:37,361,-2,2.5,0,84.0,1400.0,1,1,0,0,"the goal was to determine the peak day of the illness, and the number of cases that day. it was to simply estimate using data from current and past season and 2 seasons ago."
1793,2023-02-04 15:25:49,2023-02-04 15:29:47,237,4,10.0,1,57.0,1465.0,0,0,1,0,To make an estimate of the course and possible peak of an epidemic based on previous data.  It mentioned data from the last two seasons and graphed to visually represent the data.
5818,2023-02-04 15:21:46,2023-02-04 15:29:47,480,1,5.0,0,98.0,1420.0,1,1,1,1,To study how people make predictions based on models
4137,2023-02-04 15:25:52,2023-02-04 15:29:48,236,-2,5.0,0,71.0,879.0,1,1,1,0,To see how we observe correlations
1346,2023-02-04 15:26:08,2023-02-04 15:29:57,228,3,5.0,1,82.0,1150.0,1,1,1,1,"When presented with historic trends and current predictions for a phenomenon, how individuals combine or ignore parts of those data sets when making their own forecasts"
1796,2023-02-04 15:26:37,2023-02-04 15:29:59,202,4,10.0,0,57.0,1454.0,0,1,0,0,This study explored graph and data interpretations. The interactive model aimed to discover math profiency. 
3347,2023-02-04 15:23:09,2023-02-04 15:29:59,410,2,2.5,0,112.0,400.0,1,1,1,0,Estimate what day the pandemic will peak and how many hospitalizations will occur on that day based on two previous seasons and current surveillance.
3351,2023-02-04 15:28:49,2023-02-04 15:30:01,71,-2,2.5,1,1000.0,2500.0,0,1,0,1,How people perceive graphs and draw conclusions from data 
973,2023-02-04 15:24:24,2023-02-04 15:30:13,348,2,10.0,1,120.0,1400.0,0,1,1,0,"To find out when the epidemic would peak. Also, how many would be effected by it."
3365,2023-02-04 15:25:43,2023-02-04 15:30:14,270,4,5.0,1,57.0,62.0,0,0,1,0,My prediction of the day that an epidemic will peak and the number of reported incident hospitalizations on that day.
1394,2023-02-04 15:23:03,2023-02-04 15:30:18,435,-2,10.0,1,93.0,1123.0,1,1,1,0,"To predict which day is the peak day for infections reported. Also, to predict how many hospitalizations will take place on that day."
1622,2023-02-04 15:25:04,2023-02-04 15:30:22,318,1,2.5,0,61.0,25.0,0,0,1,0,To estimate the peak hospitalizations from the imagined pandemic
3536,2023-02-04 15:27:59,2023-02-04 15:30:26,146,2,2.5,0,90.0,300.0,1,1,1,0,to predict peak day of hospitalizations
2207,2023-02-04 15:17:05,2023-02-04 15:30:28,802,2,5.0,1,145.0,2000.0,1,1,0,0,I believe the goal was to determine if people have a grasp of simple mathematical models that can be used to extrapolate information based on limited data.
232,2023-02-04 15:27:43,2023-02-04 15:30:30,167,1,5.0,1,64.0,1603.0,0,0,1,0,find a peak day. hospitalizations ansd cases
833,2023-02-04 15:28:13,2023-02-04 15:30:30,137,-2,10.0,1,90.0,1360.0,0,0,0,1,I believe the goal was to see which factors influence people in making predictions (or believing predictions that are already made) 
3665,2023-02-04 15:25:35,2023-02-04 15:30:31,295,3,5.0,1,105.0,900.0,1,1,1,1,To collect information about how people interpret data.
1646,2023-02-04 15:28:31,2023-02-04 15:30:31,120,-2,5.0,0,90.0,1000.0,1,0,0,0,To gauge how people make estimations and predictions based on visual data points. 
218,2023-02-04 15:23:07,2023-02-04 15:30:32,444,2,10.0,0,50.0,100.0,0,1,0,0,To estimate peak hospitalizations and days based on graph of survalence an past 2 seasons data
453,2023-02-04 15:26:07,2023-02-04 15:30:34,266,3,2.5,0,57.0,64.0,0,1,1,0,"The goal of this study was to determine what the day and number of hospitalizations was on the so called ""peak day""."
1823,2023-02-04 15:28:27,2023-02-04 15:30:37,130,3,5.0,0,56.0,1700.0,0,0,1,0,Estimate the peak hospitalizations and day of a fake virus.
5045,2023-02-04 15:29:38,2023-02-04 15:30:38,59,2,5.0,0,57.0,1666.0,1,0,0,0,
86,2023-02-04 15:21:27,2023-02-04 15:30:44,557,1,2.5,1,92.0,830.0,1,0,0,0,The goal was to analyze the data to forecast what the peak day and the amount of hospitalizations for the epidemic would be.
1558,2023-02-04 15:28:07,2023-02-04 15:31:00,173,1,2.5,0,90.0,1200.0,1,1,1,0,Peoples abilities to read and predict trends.
5603,2023-02-04 15:26:00,2023-02-04 15:31:04,303,1,10.0,1,110.0,1700.0,1,1,1,0,How knowledge of previous epidemics affect predictions for current epidemics.
223,2023-02-04 15:25:39,2023-02-04 15:31:05,325,-2,10.0,1,90.0,1150.0,1,0,0,0,"To determine the peak day of an epidemic, and the number of hospitalizations on the peak day."
1250,2023-02-04 15:26:29,2023-02-04 15:31:05,276,3,5.0,0,57.0,1955.0,1,1,1,0,The goal was to predict the peak day and the number of hospitalizations on that day. 
2480,2023-02-04 15:26:54,2023-02-04 15:31:07,252,4,2.5,1,150.0,1200.0,1,1,1,0,I think the goal of the study was to see how an average person with limited information would predict how quickly an illness would peak based off other illnesses stats
2557,2023-02-04 15:26:56,2023-02-04 15:31:11,255,-2,2.5,0,89.0,1670.0,1,0,0,0,Analyze a graph to predict a peak and number of cases. 
588,2023-02-04 15:21:28,2023-02-04 15:31:15,587,1,2.5,0,85.0,1200.0,1,1,1,0,to predict  the peak hospitalizations using thee data provided.
